{
	"$schema": "https://json-schema.org/draft/2020-12/schema",
	"title": "UserSuspendEventV1",
	"type": "object",
	"additionalProperties": false,
	"properties": {
		"eventId": {
			"type": "string",
			"format": "uuid"
		},
		"eventType": {
			"type": "string",
			"const": "USER_SUSPENDED"
		},
		"producer": {
			"type": "string",
			"const": "user-service"
		},
		"aggregateId": {
			"type": "string"
		},
		"occurredAt": {
			"type": "string",
			"format": "date-time"
		},
		"schemaVersion": {
			"type": "integer",
			"const": 1
		},
		"payload": {
			"properties": {
				"userId": {
					"type": "string"
				},
				"status": {
					"type": "string",
					"const": "SUSPENDED"
				}
			},
			"required": [
				"userId",
				"status"
			]
		}
	},
	"required": [
		"eventId",
		"eventType",
		"producer",
		"aggregateId",
		"occurredAt",
		"schemaVersion",
		"payload"
	]
}